{
  "schema_version": "hostproto.receipt/v1",
  "receipt_id": "dbg-rcpt-8",
  "action_id": "dbg-act-8",
  "surface": "thread-1",
  "attempted": true,
  "accepted": true,
  "executed": true,
  "verified": true,
  "outcome": "completed",
  "provider": "engine",
  "caused_events": [],
  "effects": [
    {
      "kind": "evaluate",
      "result": "17",
      "type": "int"
    }
  ],
  "revision_before": 4,
  "revision_after": 4,
  "state_before": "sha256:aaaaaaaaaaaaaaaaaaaaaaaaaaaaaaaaaaaaaaaaaaaaaaaaaaaaaaaaaaaaaaaa",
  "state_after": "sha256:aaaaaaaaaaaaaaaaaaaaaaaaaaaaaaaaaaaaaaaaaaaaaaaaaaaaaaaaaaaaaaaa",
  "evidence": [],
  "deviations": []
}
