{
  "schema_version": "hostproto.receipt/v1",
  "receipt_id": "dbg-rcpt-10",
  "action_id": "dbg-act-10",
  "surface": "thread-1",
  "attempted": true,
  "accepted": true,
  "executed": true,
  "verified": true,
  "outcome": "completed",
  "provider": "engine",
  "caused_events": [
    "thread-1-evt-000018",
    "thread-1-evt-000019"
  ],
  "effects": [
    {
      "kind": "continued",
      "thread_id": 1
    },
    {
      "kind": "stopped",
      "reason": "breakpoint",
      "line": 58,
      "hit_breakpoint_ids": [
        4
      ]
    }
  ],
  "revision_before": 5,
  "revision_after": 6,
  "state_before": "sha256:aaaaaaaaaaaaaaaaaaaaaaaaaaaaaaaaaaaaaaaaaaaaaaaaaaaaaaaaaaaaaaaa",
  "state_after": "sha256:bbbbbbbbbbbbbbbbbbbbbbbbbbbbbbbbbbbbbbbbbbbbbbbbbbbbbbbbbbbbbbbb",
  "evidence": [],
  "deviations": [
    {
      "kind": "divergence",
      "reason": "declared effect stopped:step, observed stopped:breakpoint; a breakpoint pre-empted the step and the receipt says so",
      "object_ids": [
        "thread-1"
      ]
    }
  ]
}
