{
  "schema_version": "hostproto.receipt/v1",
  "receipt_id": "receipt-0002",
  "action_id": "action-0002",
  "surface": "page-1",
  "attempted": true,
  "accepted": true,
  "executed": false,
  "verified": false,
  "provider": "injected",
  "caused_events": [],
  "effects": [],
  "revision_before": 2,
  "revision_after": 3,
  "state_before": "sha256:aaaaaaaaaaaaaaaaaaaaaaaaaaaaaaaaaaaaaaaaaaaaaaaaaaaaaaaaaaaaaaaa",
  "state_after": "sha256:bbbbbbbbbbbbbbbbbbbbbbbbbbbbbbbbbbbbbbbbbbbbbbbbbbbbbbbbbbbbbbbb",
  "evidence": [],
  "deviations": [
    {
      "kind": "divergence",
      "reason": "deadline elapsed after the host was invoked; canonical state reconciled from the next observation"
    }
  ],
  "outcome": "unknown"
}
